{
  "allowed_overlaps": [
    {
      "approval": "source-layout-candidate",
      "entity_ids": [
        "ptlc.proxy:collection_station",
        "ptlc.proxy:machine_deck"
      ],
      "reason": "station supported on table top"
    },
    {
      "approval": "source-layout-candidate",
      "entity_ids": [
        "ptlc.proxy:collection_station",
        "ptlc.proxy:staging_b_6slot"
      ],
      "reason": "tray intentionally mounted on collection-station deck"
    },
    {
      "approval": "source-layout-candidate",
      "entity_ids": [
        "ptlc.proxy:develop_tank_rack",
        "ptlc.proxy:machine_deck"
      ],
      "reason": "rack supported on table top"
    },
    {
      "approval": "source-layout-candidate",
      "entity_ids": [
        "ptlc.proxy:feed_lift",
        "ptlc.proxy:machine_deck"
      ],
      "reason": "auxiliary edge-supported station"
    },
    {
      "approval": "source-layout-candidate",
      "entity_ids": [
        "ptlc.proxy:group_rack_4x3",
        "ptlc.proxy:machine_deck"
      ],
      "reason": "rack supported on table top"
    },
    {
      "approval": "source-layout-candidate",
      "entity_ids": [
        "ptlc.proxy:machine_deck",
        "ptlc.proxy:photo_scrape_station"
      ],
      "reason": "station supported on table top"
    },
    {
      "approval": "source-layout-candidate",
      "entity_ids": [
        "ptlc.proxy:machine_deck",
        "ptlc.proxy:rail_11y"
      ],
      "reason": "rail supported on table top"
    },
    {
      "approval": "source-layout-candidate",
      "entity_ids": [
        "ptlc.proxy:machine_deck",
        "ptlc.proxy:sampling_station"
      ],
      "reason": "station supported on table top"
    },
    {
      "approval": "source-layout-candidate",
      "entity_ids": [
        "ptlc.proxy:machine_deck",
        "ptlc.proxy:tool_station"
      ],
      "reason": "station supported on table top"
    },
    {
      "approval": "source-layout-candidate",
      "entity_ids": [
        "ptlc.proxy:photo_scrape_station",
        "ptlc.proxy:powder_collector_fixture"
      ],
      "reason": "fixture intentionally nested on photo/scrape plate"
    },
    {
      "approval": "source-layout-candidate",
      "entity_ids": [
        "ptlc.proxy:sampling_station",
        "ptlc.proxy:staging_a_6slot"
      ],
      "reason": "tray intentionally mounted on sampling-station deck"
    },
    {
      "approval": "source-layout-candidate",
      "entity_ids": [
        "ptlc.proxy:tool_large_gripper",
        "ptlc.proxy:tool_station"
      ],
      "reason": "tool intentionally stored in station"
    },
    {
      "approval": "source-layout-candidate",
      "entity_ids": [
        "ptlc.proxy:tool_small_gripper",
        "ptlc.proxy:tool_station"
      ],
      "reason": "tool intentionally stored in station"
    },
    {
      "approval": "source-layout-candidate",
      "entity_ids": [
        "ptlc.proxy:tool_station",
        "ptlc.proxy:tool_suction"
      ],
      "reason": "tool intentionally stored in station"
    }
  ],
  "entities": [
    {
      "collision_mode": "multi-body-open",
      "component_count": 6,
      "component_world_aabbs": [],
      "dynamic": false,
      "entity_id": "ptlc.proxy:collection_station",
      "geometry_format": "stl",
      "geometry_path": "related/unilabSZlab/pTLC仿真资产/proxies/collection_station/collision.stl",
      "geometry_sha256": "9b5139986ecb10d8d79ae50109f73f9631cd123859c0a8df00813e5adfcc7fc1",
      "geometry_unit": "mm",
      "local_aabb": {
        "max_m": [
          0.325,
          0.26,
          0.85
        ],
        "min_m": [
          -0.325,
          -0.26,
          0.0
        ]
      },
      "pose_world": {
        "rpy_deg": [
          0.0,
          0.0,
          0.0
        ],
        "xyz_m": [
          -0.1,
          0.5,
          0.85
        ]
      },
      "qualification": "simulation-proxy-only",
      "role": "static-environment",
      "uncertainty_m_xyz": [
        0.14,
        0.12,
        0.16
      ],
      "world_aabb": {
        "max_m": [
          0.225,
          0.76,
          1.7
        ],
        "min_m": [
          -0.425,
          0.24,
          0.85
        ]
      }
    },
    {
      "collision_mode": "compound-convex",
      "component_count": 40,
      "component_triangle_counts": [
        12,
        12,
        12,
        12,
        12,
        12,
        12,
        12,
        12,
        12,
        12,
        12,
        12,
        12,
        12,
        12,
        12,
        12,
        12,
        12,
        12,
        12,
        12,
        12,
        12,
        12,
        12,
        12,
        12,
        12,
        12,
        12,
        12,
        12,
        12,
        12,
        12,
        12,
        12,
        12
      ],
      "component_world_aabbs": [
        {
          "max_m": [
            1.329399994016,
            0.484650010347,
            1.695499992371
          ],
          "min_m": [
            0.870600005984,
            0.226350003958,
            1.670500016212
          ]
        },
        {
          "max_m": [
            1.310800006986,
            0.475199991941,
            1.668300008774
          ],
          "min_m": [
            0.889199993014,
            0.235799992561,
            1.550699985027
          ]
        },
        {
          "max_m": [
            1.329399994016,
            0.484650010347,
            1.48480001688
          ],
          "min_m": [
            0.870600005984,
            0.226350003958,
            1.459799981117
          ]
        },
        {
          "max_m": [
            1.310800006986,
            0.475199991941,
            1.457599973679
          ],
          "min_m": [
            0.889199993014,
            0.235799992561,
            1.340000009537
          ]
        },
        {
          "max_m": [
            1.329399994016,
            0.484650010347,
            1.274100011587
          ],
          "min_m": [
            0.870600005984,
            0.226350003958,
            1.249100005627
          ]
        },
        {
          "max_m": [
            1.310800006986,
            0.475199991941,
            1.246899998188
          ],
          "min_m": [
            0.889199993014,
            0.235799992561,
            1.129300004244
          ]
        },
        {
          "max_m": [
            1.329399994016,
            0.484650010347,
            1.063400006294
          ],
          "min_m": [
            0.870600005984,
            0.226350003958,
            1.038400000334
          ]
        },
        {
          "max_m": [
            1.310800006986,
            0.475199991941,
            1.036199992895
          ],
          "min_m": [
            0.889199993014,
            0.235799992561,
            0.918599998951
          ]
        },
        {
          "max_m": [
            1.410000002384,
            0.512999976158,
            1.830000019073
          ],
          "min_m": [
            0.789999997616,
            0.473000014305,
            1.789999997616
          ]
        },
        {
          "max_m": [
            1.410000002384,
            0.238,
            1.830000019073
          ],
          "min_m": [
            0.789999997616,
            0.197999993443,
            1.789999997616
          ]
        },
        {
          "max_m": [
            0.829999989271,
            0.512999976158,
            1.830000019073
          ],
          "min_m": [
            0.789999997616,
            0.197999993443,
            1.789999997616
          ]
        },
        {
          "max_m": [
            1.410000002384,
            0.512999976158,
            1.830000019073
          ],
          "min_m": [
            1.370000010729,
            0.197999993443,
            1.789999997616
          ]
        },
        {
          "max_m": [
            1.410000002384,
            0.512999976158,
            0.889999999106
          ],
          "min_m": [
            0.789999997616,
            0.473000014305,
            0.85
          ]
        },
        {
          "max_m": [
            1.410000002384,
            0.238,
            0.889999999106
          ],
          "min_m": [
            0.789999997616,
            0.197999993443,
            0.85
          ]
        },
        {
          "max_m": [
            0.829999989271,
            0.512999976158,
            0.889999999106
          ],
          "min_m": [
            0.789999997616,
            0.197999993443,
            0.85
          ]
        },
        {
          "max_m": [
            1.410000002384,
            0.512999976158,
            0.889999999106
          ],
          "min_m": [
            1.370000010729,
            0.197999993443,
            0.85
          ]
        },
        {
          "max_m": [
            0.829999989271,
            0.512999976158,
            1.830000019073
          ],
          "min_m": [
            0.789999997616,
            0.473000014305,
            0.85
          ]
        },
        {
          "max_m": [
            1.410000002384,
            0.512999976158,
            1.830000019073
          ],
          "min_m": [
            1.370000010729,
            0.473000014305,
            0.85
          ]
        },
        {
          "max_m": [
            0.829999989271,
            0.238,
            1.830000019073
          ],
          "min_m": [
            0.789999997616,
            0.197999993443,
            0.85
          ]
        },
        {
          "max_m": [
            1.410000002384,
            0.238,
            1.830000019073
          ],
          "min_m": [
            1.370000010729,
            0.197999993443,
            0.85
          ]
        },
        {
          "max_m": [
            1.329399994016,
            -0.250350003958,
            1.695499992371
          ],
          "min_m": [